Holder,Shares,Date Reported,% Out,Value,ABV
"ARK Investment Management, LLC",662499,2021-12-30,0.037200000000000004,2577121,PPBT
"Point72 Asset Management, L.P.",279294,2021-09-29,0.015700000000000002,1279166,PPBT
Morgan Stanley,23560,2021-09-29,0.0013,107904,PPBT
Washington Trust Bank,16454,2021-12-30,0.0009,64006,PPBT
"Geode Capital Management, LLC",12666,2021-12-30,0.0007000000000000001,49270,PPBT
Venture Visionary Partners LLC,11068,2021-12-30,0.0006,43054,PPBT
"Group One Trading, L.P.",8080,2021-12-30,0.0005,31431,PPBT
UBS Group AG,4079,2021-09-29,0.0002,18681,PPBT
