Holder,Shares,Date Reported,% Out,Value,ABV
"Vanguard Group, Inc. (The)",247451,2021-09-29,0.0154,668117,SONM
"Jane Street Group, LLC",95603,2021-09-29,0.006,258128,SONM
"Geode Capital Management, LLC",71537,2021-09-29,0.0045000000000000005,193149,SONM
"Susquehanna Fundamental Investments, LLC",47700,2021-09-29,0.003,128790,SONM
Morgan Stanley,47590,2021-09-29,0.003,128493,SONM
Bank Of New York Mellon Corporation,22671,2021-09-29,0.0014000000000000002,61211,SONM
Tower Research Capital LLC (TRC),12066,2021-09-29,0.0008,32578,SONM
Dynamic Advisors Solutions LLC,11911,2021-09-29,0.0007000000000000001,32159,SONM
UBS Group AG,1629,2021-09-29,0.0001,4398,SONM
